<?xml version="1.0" encoding="UTF-8" standalone="no" ?>
<?xml-stylesheet type="text/xsl" href="../../util/style/ca-regional-2-2.xsl"?>
<hcsc_ectd xmlns="hcsc_ectd" schema-version="2.2" xmlns:xlink="http://www.w3.org/1999/xlink" xmlns:xsi="http://www.w3.org/2001/XMLSchema-instance" xsi:schemaLocation="hcsc_ectd ../../util/dtd/ca-regional-2-2.xsd">

  <ectd-regulatory-transaction-information>
    <applicant>valtest</applicant>
    <product-name>wonderpill</product-name>
    <dossier-identifier>e123456</dossier-identifier>
    <dossier-type>Pharmaceutical Dossier</dossier-type>
    <regulatory-activity-type>NDS</regulatory-activity-type>
    <regulatory-activity-lead>Pharmaceutical</regulatory-activity-lead>
    <sequence-number>0000</sequence-number>
    <sequence-description>INITIAL</sequence-description>
  </ectd-regulatory-transaction-information>

  <m1-administrative-and-product-information>
    <m1-0-correspondence>
      <m1-0-1-cover-letter>
        <leaf ID="ID00013475" application-version="PDF 1.6" checksum="60580bda2e79ee0da2ca580fd2a2be54" checksum-type="MD5" operation="new" xlink:href="cover-letter.pdf">
          <title>Cover Letter</title>
        </leaf>
      </m1-0-1-cover-letter>
      <m1-0-2-life-cycle-management-table>
        <leaf ID="ID00013476" checksum="9b1e9527e268cb9a42f82e5948e8b2d4" checksum-type="MD5" operation="new" xlink:href="life-cycle-management-table.docx">
          <title>Life Cycle Management Table</title>
        </leaf>
        <leaf ID="ID00013477" application-version="PDF 1.6" checksum="1ec938f0eecb2149a362209a95217e1b" checksum-type="MD5" operation="new" xlink:href="life-cycle-management-table.pdf">
          <title>Life Cycle Management Table</title>
        </leaf>
      </m1-0-2-life-cycle-management-table>
    </m1-0-correspondence>
  </m1-administrative-and-product-information>

</hcsc_ectd>
